[2025-11-11 15:14:25] [ERROR] 
❌ Error running Manim on C:/Vivek_Main/Manim_project/inputbox/268778a7-ed05-4257-b024-7579c5bbc8fa_20251111_151353/script_seq1/script_seq1.py
──────────────────────────────────────────────
STDERR:
Animation 0: FadeIn(Text('Labels at Square Corners: Class 10 English')):   0%|          | 0/15 [00:00<?, ?it/s]
Animation 0: FadeIn(Text('Labels at Square Corners: Class 10 English')):  20%|##        | 3/15 [00:00<00:00, 20.38it/s]
Animation 0: FadeIn(Text('Labels at Square Corners: Class 10 English')):  40%|####      | 6/15 [00:00<00:00, 22.44it/s]
Animation 0: FadeIn(Text('Labels at Square Corners: Class 10 English')):  60%|######    | 9/15 [00:00<00:00, 22.34it/s]
Animation 0: FadeIn(Text('Labels at Square Corners: Class 10 English')):  80%|########  | 12/15 [00:00<00:00, 24.44it/s]
Animation 0: FadeIn(Text('Labels at Square Corners: Class 10 English')): 100%|##########| 15/15 [00:00<00:00, 24.48it/s]
                                                                                                                        

Animation 2: FadeIn(NumberPlane of 4 submobjects), etc.:   0%|          | 0/15 [00:00<?, ?it/s]
Animation 2: FadeIn(NumberPlane of 4 submobjects), etc.:   7%|6         | 1/15 [00:00<00:02,  5.92it/s]
Animation 2: FadeIn(NumberPlane of 4 submobjects), etc.:  20%|##        | 3/15 [00:00<00:01, 11.35it/s]
Animation 2: FadeIn(NumberPlane of 4 submobjects), etc.:  33%|###3      | 5/15 [00:00<00:00, 10.77it/s]
Animation 2: FadeIn(NumberPlane of 4 submobjects), etc.:  47%|####6     | 7/15 [00:00<00:00,  9.06it/s]
Animation 2: FadeIn(NumberPlane of 4 submobjects), etc.:  60%|######    | 9/15 [00:00<00:00,  9.64it/s]
Animation 2: FadeIn(NumberPlane of 4 submobjects), etc.:  73%|#######3  | 11/15 [00:01<00:00,  7.67it/s]
Animation 2: FadeIn(NumberPlane of 4 submobjects), etc.:  87%|########6 | 13/15 [00:01<00:00,  9.58it/s]
                                                                                                        

Animation 4: FadeIn(Square):   0%|          | 0/15 [00:00<?, ?it/s]
Animation 4: FadeIn(Square):  80%|########  | 12/15 [00:00<00:00, 117.28it/s]
                                                                             
+--------------------- Traceback (most recent call last) ---------------------+
| C:\Vivek_Main\tutter\.venv\Lib\site-packages\manim\cli\render\commands.py:1 |
| 25 in render                                                                |
|                                                                             |
|   122             try:                                                      |
|   123                 with tempconfig({}):                                  |
|   124                     scene = SceneClass()                              |
| > 125                     scene.render()                                    |
|   126             except Exception:                                         |
|   127                 error_console.print_exception()                       |
|   128                 sys.exit(1)                                           |
|                                                                             |
| C:\Vivek_Main\tutter\.venv\Lib\site-packages\manim\scene\scene.py:237 in    |
| render                                                                      |
|                                                                             |
|    234         """                                                          |
|    235         self.setup()                                                 |
|    236         try:                                                         |
| >  237             self.construct()                                         |
|    238         except EndSceneEarlyException:                               |
|    239             pass                                                     |
|    240         except RerunSceneException:                                  |
|                                                                             |
| C:\Vivek_Main\Manim_project\inputbox\268778a7-ed05-4257-b024-7579c5bbc8fa_2 |
| 0251111_151353\script_seq1\script_seq1.py:33 in construct                   |
|                                                                             |
|   30         labels = ["A", "B", "C", "D"]                                  |
|   31         dots = VGroup()                                                |
|   32         for i, label in enumerate(labels):                             |
| > 33             dot = Dot(color=BLACK).move_to([[-0.5, -0.5], [0.5, -0.5], |
|   34             label_text = Text(label, font_size=24, color=BLACK).next_t |
|   35             dots.add(VGroup(dot, label_text))                          |
|   36         self.play(*[FadeIn(dot) for dot in dots])                      |
|                                                                             |
| C:\Vivek_Main\tutter\.venv\Lib\site-packages\manim\mobject\mobject.py:1745  |
| in move_to                                                                  |
|                                                                             |
|   1742         else:                                                        |
|   1743             target = point_or_mobject                                |
|   1744         point_to_align = self.get_critical_point(aligned_edge)       |
| > 1745         self.shift((target - point_to_align) * coor_mask)            |
|   1746         return self                                                  |
|   1747                                                                      |
|   1748     def replace(                                                     |
+-----------------------------------------------------------------------------+
ValueError: operands could not be broadcast together with shapes (2,) (3,)

STDOUT:
Manim Community v0.19.0

[11/11/25 15:14:12] INFO     Animation 0 : Partial     scene_file_writer.py:588
                             movie file written in                             
                             'C:\Vivek_Main\tutter\src                         
                             \media\videos\268778a7-ed                         
                             05-4257-b024-7579c5bbc8fa                         
                             _20251111_151353\script_s                         
                             eq1\videos\script_seq1\48                         
                             0p15\partial_movie_files\                         
                             SquareCornerLabels\931832                         
                             650_3107961746_223132457.                         
                             mp4'                                              
[11/11/25 15:14:13] INFO     Animation 1 : Partial     scene_file_writer.py:588
                             movie file written in                             
                             'C:\Vivek_Main\tutter\src                         
                             \media\videos\268778a7-ed                         
                             05-4257-b024-7579c5bbc8fa                         
                             _20251111_151353\script_s                         
                             eq1\videos\script_seq1\48                         
                             0p15\partial_movie_files\                         
                             SquareCornerLabels\190528                         
                             8516_1436906429_199757199                         
                             4.mp4'                                            
[11/11/25 15:14:19] INFO     Animation 2 : Partial     scene_file_writer.py:588
                             movie file written in                             
                             'C:\Vivek_Main\tutter\src                         
                             \media\videos\268778a7-ed                         
                             05-4257-b024-7579c5bbc8fa                         
                             _20251111_151353\script_s                         
                             eq1\videos\script_seq1\48                         
                             0p15\partial_movie_files\                         
                             SquareCornerLabels\190528                         
                             8516_2560530723_261582381                         
                             5.mp4'                                            
[11/11/25 15:14:20] INFO     Animation 3 : Partial     scene_file_writer.py:588
                             movie file written in                             
                             'C:\Vivek_Main\tutter\src                         
                             \media\videos\268778a7-ed                         
                             05-4257-b024-7579c5bbc8fa                         
                             _20251111_151353\script_s                         
                             eq1\videos\script_seq1\48                         
                             0p15\partial_movie_files\                         
                             SquareCornerLabels\190528                         
                             8516_1436906429_409536564                         
                             .mp4'                                             
[11/11/25 15:14:22] INFO     Animation 4 : Partial     scene_file_writer.py:588
                             movie file written in                             
                             'C:\Vivek_Main\tutter\src                         
                             \media\videos\268778a7-ed                         
                             05-4257-b024-7579c5bbc8fa                         
                             _20251111_151353\script_s                         
                             eq1\videos\script_seq1\48                         
                             0p15\partial_movie_files\                         
                             SquareCornerLabels\190528                         
                             8516_3938066703_256008400                         
                             .mp4'                                             
[11/11/25 15:14:23] INFO     Animation 5 : Partial     scene_file_writer.py:588
                             movie file written in                             
                             'C:\Vivek_Main\tutter\src                         
                             \media\videos\268778a7-ed                         
                             05-4257-b024-7579c5bbc8fa                         
                             _20251111_151353\script_s                         
                             eq1\videos\script_seq1\48                         
                             0p15\partial_movie_files\                         
                             SquareCornerLabels\190528                         
                             8516_1436906429_113136138                         
                             5.mp4'
──────────────────────────────────────────────

[2025-11-11 15:15:07] [ERROR] 
❌ Error running Manim on C:/Vivek_Main/Manim_project/inputbox/268778a7-ed05-4257-b024-7579c5bbc8fa_20251111_151353/script_seq2/script_seq2.py
──────────────────────────────────────────────
STDERR:
Aborted!

STDOUT:
Manim Community v0.19.0

[11/11/25 15:14:44] INFO     Writing A to               tex_file_writing.py:111
                             C:\Vivek_Main\tutter\src\m                        
                             edia\videos\268778a7-ed05-                        
                             4257-b024-7579c5bbc8fa_202                        
                             51111_151353\script_seq2\T                        
                             ex\90f07b07e57adf79.tex                           
[11/11/25 15:14:51] INFO     Writing B to               tex_file_writing.py:111
                             C:\Vivek_Main\tutter\src\m                        
                             edia\videos\268778a7-ed05-                        
                             4257-b024-7579c5bbc8fa_202                        
                             51111_151353\script_seq2\T                        
                             ex\d82288bb87e99d59.tex
──────────────────────────────────────────────

[2025-11-11 15:15:54] [ERROR] ❌ Error generating code
Traceback (most recent call last):
  File "C:\Vivek_Main\tutter\.venv\Lib\site-packages\httpx\_transports\default.py", line 101, in map_httpcore_exceptions
    yield
  File "C:\Vivek_Main\tutter\.venv\Lib\site-packages\httpx\_transports\default.py", line 394, in handle_async_request
    resp = await self._pool.handle_async_request(req)
           ^^^^^^^^^^^^^^^^^^^^^^^^^^^^^^^^^^^^^^^^^^
  File "C:\Vivek_Main\tutter\.venv\Lib\site-packages\httpcore\_async\connection_pool.py", line 256, in handle_async_request
    raise exc from None
  File "C:\Vivek_Main\tutter\.venv\Lib\site-packages\httpcore\_async\connection_pool.py", line 236, in handle_async_request
    response = await connection.handle_async_request(
               ^^^^^^^^^^^^^^^^^^^^^^^^^^^^^^^^^^^^^^
  File "C:\Vivek_Main\tutter\.venv\Lib\site-packages\httpcore\_async\connection.py", line 103, in handle_async_request
    return await self._connection.handle_async_request(request)
           ^^^^^^^^^^^^^^^^^^^^^^^^^^^^^^^^^^^^^^^^^^^^^^^^^^^^
  File "C:\Vivek_Main\tutter\.venv\Lib\site-packages\httpcore\_async\http11.py", line 136, in handle_async_request
    raise exc
  File "C:\Vivek_Main\tutter\.venv\Lib\site-packages\httpcore\_async\http11.py", line 106, in handle_async_request
    ) = await self._receive_response_headers(**kwargs)
        ^^^^^^^^^^^^^^^^^^^^^^^^^^^^^^^^^^^^^^^^^^^^^^
  File "C:\Vivek_Main\tutter\.venv\Lib\site-packages\httpcore\_async\http11.py", line 177, in _receive_response_headers
    event = await self._receive_event(timeout=timeout)
            ^^^^^^^^^^^^^^^^^^^^^^^^^^^^^^^^^^^^^^^^^^
  File "C:\Vivek_Main\tutter\.venv\Lib\site-packages\httpcore\_async\http11.py", line 217, in _receive_event
    data = await self._network_stream.read(
           ^^^^^^^^^^^^^^^^^^^^^^^^^^^^^^^^
  File "C:\Vivek_Main\tutter\.venv\Lib\site-packages\httpcore\_backends\anyio.py", line 32, in read
    with map_exceptions(exc_map):
  File "C:\Users\vivek_vslen2j\AppData\Local\Programs\Python\Python311\Lib\contextlib.py", line 158, in __exit__
    self.gen.throw(typ, value, traceback)
  File "C:\Vivek_Main\tutter\.venv\Lib\site-packages\httpcore\_exceptions.py", line 14, in map_exceptions
    raise to_exc(exc) from exc
httpcore.ReadTimeout

The above exception was the direct cause of the following exception:

Traceback (most recent call last):
  File "C:\Vivek_Main\tutter\src\video_pipeline\routes\generator_routes.py", line 28, in generate_code_endpoint
    write_result = await async_post(write_url, result, timeout=120)
                   ^^^^^^^^^^^^^^^^^^^^^^^^^^^^^^^^^^^^^^^^^^^^^^^^
  File "C:\Vivek_Main\tutter\src\video_pipeline\utils.py", line 12, in async_post
    resp = await client.post(url, json=payload, headers={"Content-Type": "application/json"})
           ^^^^^^^^^^^^^^^^^^^^^^^^^^^^^^^^^^^^^^^^^^^^^^^^^^^^^^^^^^^^^^^^^^^^^^^^^^^^^^^^^^
  File "C:\Vivek_Main\tutter\.venv\Lib\site-packages\httpx\_client.py", line 1859, in post
    return await self.request(
           ^^^^^^^^^^^^^^^^^^^
  File "C:\Vivek_Main\tutter\.venv\Lib\site-packages\httpx\_client.py", line 1540, in request
    return await self.send(request, auth=auth, follow_redirects=follow_redirects)
           ^^^^^^^^^^^^^^^^^^^^^^^^^^^^^^^^^^^^^^^^^^^^^^^^^^^^^^^^^^^^^^^^^^^^^^
  File "C:\Vivek_Main\tutter\.venv\Lib\site-packages\httpx\_client.py", line 1629, in send
    response = await self._send_handling_auth(
               ^^^^^^^^^^^^^^^^^^^^^^^^^^^^^^^
  File "C:\Vivek_Main\tutter\.venv\Lib\site-packages\httpx\_client.py", line 1657, in _send_handling_auth
    response = await self._send_handling_redirects(
               ^^^^^^^^^^^^^^^^^^^^^^^^^^^^^^^^^^^^
  File "C:\Vivek_Main\tutter\.venv\Lib\site-packages\httpx\_client.py", line 1694, in _send_handling_redirects
    response = await self._send_single_request(request)
               ^^^^^^^^^^^^^^^^^^^^^^^^^^^^^^^^^^^^^^^^
  File "C:\Vivek_Main\tutter\.venv\Lib\site-packages\httpx\_client.py", line 1730, in _send_single_request
    response = await transport.handle_async_request(request)
               ^^^^^^^^^^^^^^^^^^^^^^^^^^^^^^^^^^^^^^^^^^^^^
  File "C:\Vivek_Main\tutter\.venv\Lib\site-packages\httpx\_transports\default.py", line 393, in handle_async_request
    with map_httpcore_exceptions():
  File "C:\Users\vivek_vslen2j\AppData\Local\Programs\Python\Python311\Lib\contextlib.py", line 158, in __exit__
    self.gen.throw(typ, value, traceback)
  File "C:\Vivek_Main\tutter\.venv\Lib\site-packages\httpx\_transports\default.py", line 118, in map_httpcore_exceptions
    raise mapped_exc(message) from exc
httpx.ReadTimeout
[2025-11-11 15:15:55] [ERROR] ❌ HTTP 500: {"detail":""}
[2025-11-11 15:15:57] [ERROR] 
❌ Error running Manim on C:/Vivek_Main/Manim_project/inputbox/268778a7-ed05-4257-b024-7579c5bbc8fa_20251111_151353/script_seq3/script_seq3.py
──────────────────────────────────────────────
STDERR:
Animation 0: FadeIn(VGroup of 5 submobjects):   0%|          | 0/15 [00:00<?, ?it/s]
Animation 0: FadeIn(VGroup of 5 submobjects):  47%|####6     | 7/15 [00:00<00:00, 62.62it/s]
Animation 0: FadeIn(VGroup of 5 submobjects): 100%|##########| 15/15 [00:00<00:00, 70.70it/s]
                                                                                             

Animation 1: FadeIn(VGroup of 5 submobjects):   0%|          | 0/15 [00:00<?, ?it/s]
Animation 1: FadeIn(VGroup of 5 submobjects):  40%|####      | 6/15 [00:00<00:00, 50.99it/s]
Animation 1: FadeIn(VGroup of 5 submobjects):  80%|########  | 12/15 [00:00<00:00, 46.42it/s]
                                                                                             
+--------------------- Traceback (most recent call last) ---------------------+
| C:\Vivek_Main\tutter\.venv\Lib\site-packages\manim\cli\render\commands.py:1 |
| 25 in render                                                                |
|                                                                             |
|   122             try:                                                      |
|   123                 with tempconfig({}):                                  |
|   124                     scene = SceneClass()                              |
| > 125                     scene.render()                                    |
|   126             except Exception:                                         |
|   127                 error_console.print_exception()                       |
|   128                 sys.exit(1)                                           |
|                                                                             |
| C:\Vivek_Main\tutter\.venv\Lib\site-packages\manim\scene\scene.py:237 in    |
| render                                                                      |
|                                                                             |
|    234         """                                                          |
|    235         self.setup()                                                 |
|    236         try:                                                         |
| >  237             self.construct()                                         |
|    238         except EndSceneEarlyException:                               |
|    239             pass                                                     |
|    240         except RerunSceneException:                                  |
|                                                                             |
| C:\Vivek_Main\Manim_project\inputbox\268778a7-ed05-4257-b024-7579c5bbc8fa_2 |
| 0251111_151353\script_seq3\script_seq3.py:33 in construct                   |
|                                                                             |
|   30         # Animate labels appearing at corners                          |
|   31         labels = VGroup()                                              |
|   32         for square in highlighted_row:                                 |
| > 33             corners = square.get_corners()                             |
|   34             for i, corner in enumerate(corners):                       |
|   35                 label = Text(f"{chr(65 + i)}", font_size=24, color=BLA |
|   36                 labels.add(label)                                      |
|                                                                             |
| C:\Vivek_Main\tutter\.venv\Lib\site-packages\manim\mobject\mobject.py:698   |
| in getter                                                                   |
|                                                                             |
|    695                     stacklevel=2,                                    |
|    696                 )                                                    |
|    697                                                                      |
| >  698                 return getattr(self, to_get)                         |
|    699                                                                      |
|    700             # Return a bound method                                  |
|    701             return types.MethodType(getter, self)                    |
|                                                                             |
| C:\Vivek_Main\tutter\.venv\Lib\site-packages\manim\mobject\mobject.py:723   |
| in __getattr__                                                              |
|                                                                             |
|    720             return types.MethodType(setter, self)                    |
|    721                                                                      |
|    722         # Unhandled attribute, therefore error                       |
| >  723         raise AttributeError(f"{type(self).__name__} object has no a |
|    724                                                                      |
|    725     @property                                                        |
|    726     def width(self) -> float:                                        |
+-----------------------------------------------------------------------------+
AttributeError: Square object has no attribute 'corners'

STDOUT:
Manim Community v0.19.0

[11/11/25 15:15:54] INFO     Animation 0 : Partial     scene_file_writer.py:588
                             movie file written in                             
                             'C:\Vivek_Main\tutter\src                         
                             \media\videos\268778a7-ed                         
                             05-4257-b024-7579c5bbc8fa                         
                             _20251111_151353\script_s                         
                             eq3\videos\script_seq3\48                         
                             0p15\partial_movie_files\                         
                             ClassroomSeatingAnimation                         
                             \931832650_2309765187_223                         
                             132457.mp4'                                       
[11/11/25 15:15:55] INFO     Animation 1 : Partial     scene_file_writer.py:588
                             movie file written in                             
                             'C:\Vivek_Main\tutter\src                         
                             \media\videos\268778a7-ed                         
                             05-4257-b024-7579c5bbc8fa                         
                             _20251111_151353\script_s                         
                             eq3\videos\script_seq3\48                         
                             0p15\partial_movie_files\                         
                             ClassroomSeatingAnimation                         
                             \1905288516_2682669870_28                         
                             45722946.mp4'                                     
[11/11/25 15:15:56] INFO     Animation 2 : Partial     scene_file_writer.py:588
                             movie file written in                             
                             'C:\Vivek_Main\tutter\src                         
                             \media\videos\268778a7-ed                         
                             05-4257-b024-7579c5bbc8fa                         
                             _20251111_151353\script_s                         
                             eq3\videos\script_seq3\48                         
                             0p15\partial_movie_files\                         
                             ClassroomSeatingAnimation                         
                             \1905288516_1219373736_11                         
                             67301422.mp4'
──────────────────────────────────────────────

[2025-11-11 15:16:15] [ERROR] 
❌ Error running Manim on C:/Vivek_Main/Manim_project/inputbox/268778a7-ed05-4257-b024-7579c5bbc8fa_20251111_151353/script_seq4/script_seq4.py
──────────────────────────────────────────────
STDERR:
Animation 0: FadeIn(VGroup of 50 submobjects):   0%|          | 0/15 [00:00<?, ?it/s]
Animation 0: FadeIn(VGroup of 50 submobjects):  20%|##        | 3/15 [00:00<00:00, 21.78it/s]
Animation 0: FadeIn(VGroup of 50 submobjects):  40%|####      | 6/15 [00:00<00:00, 24.12it/s]
Animation 0: FadeIn(VGroup of 50 submobjects):  60%|######    | 9/15 [00:00<00:00, 25.28it/s]
Animation 0: FadeIn(VGroup of 50 submobjects):  80%|########  | 12/15 [00:00<00:00, 23.92it/s]
Animation 0: FadeIn(VGroup of 50 submobjects): 100%|##########| 15/15 [00:00<00:00, 24.51it/s]
                                                                                              
+--------------------- Traceback (most recent call last) ---------------------+
| C:\Vivek_Main\tutter\.venv\Lib\site-packages\manim\cli\render\commands.py:1 |
| 25 in render                                                                |
|                                                                             |
|   122             try:                                                      |
|   123                 with tempconfig({}):                                  |
|   124                     scene = SceneClass()                              |
| > 125                     scene.render()                                    |
|   126             except Exception:                                         |
|   127                 error_console.print_exception()                       |
|   128                 sys.exit(1)                                           |
|                                                                             |
| C:\Vivek_Main\tutter\.venv\Lib\site-packages\manim\scene\scene.py:237 in    |
| render                                                                      |
|                                                                             |
|    234         """                                                          |
|    235         self.setup()                                                 |
|    236         try:                                                         |
| >  237             self.construct()                                         |
|    238         except EndSceneEarlyException:                               |
|    239             pass                                                     |
|    240         except RerunSceneException:                                  |
|                                                                             |
| C:\Vivek_Main\Manim_project\inputbox\268778a7-ed05-4257-b024-7579c5bbc8fa_2 |
| 0251111_151353\script_seq4\script_seq4.py:10 in construct                   |
|                                                                             |
|    7         self.play(FadeIn(grid))                                        |
|    8                                                                        |
|    9         # Zoom out to show the entire grid                             |
| > 10         self.play(self.camera.frame.animate.set(width=10).move_to(grid |
|   11                                                                        |
|   12         # Fade in a summary text box                                   |
|   13         summary_text = Text("Labels at corners ensure clarity and prec |
+-----------------------------------------------------------------------------+
AttributeError: 'Camera' object has no attribute 'frame'

STDOUT:
Manim Community v0.19.0

[11/11/25 15:16:14] INFO     Animation 0 : Partial     scene_file_writer.py:588
                             movie file written in                             
                             'C:\Vivek_Main\tutter\src                         
                             \media\videos\268778a7-ed                         
                             05-4257-b024-7579c5bbc8fa                         
                             _20251111_151353\script_s                         
                             eq4\videos\script_seq4\48                         
                             0p15\partial_movie_files\                         
                             GridLabelingScene\1185818                         
                             338_3677646767_223132457.                         
                             mp4'
──────────────────────────────────────────────

[2025-11-11 15:16:31] [ERROR] ❌ Video and audio lists must have the same length
[2025-11-11 15:16:31] [ERROR] ❌ Video generation error
Traceback (most recent call last):
  File "C:\Vivek_Main\tutter\src\video_pipeline\routes\video_routes.py", line 32, in generate_videos_endpoint
    output_path = await process_pipeline(
                  ^^^^^^^^^^^^^^^^^^^^^^^
  File "C:\Vivek_Main\tutter\src\main.py", line 61, in process_pipeline
    final_video_bytes = MergerFactory.merge_all_videos_with_audio(video_bytes_list, audio_bytes_list,unique_id)
                        ^^^^^^^^^^^^^^^^^^^^^^^^^^^^^^^^^^^^^^^^^^^^^^^^^^^^^^^^^^^^^^^^^^^^^^^^^^^^^
  File "C:\Vivek_Main\tutter\src\merger_factory.py", line 261, in merge_all_videos_with_audio
    return MergerFactory.merge_video_with_audio(video_bytes_list, audio_bytes_list)
           ^^^^^^^^^^^^^^^^^^^^^^^^^^^^^^^^^^^^^^^^^^^^^^^^^^^^^^^^^^^^^^^^^^^^^^^^
  File "C:\Vivek_Main\tutter\src\merger_factory.py", line 136, in merge_video_with_audio
    raise ValueError("Video and audio lists must have the same length")
ValueError: Video and audio lists must have the same length
[2025-11-11 15:16:31] [ERROR] ❌ HTTP 500: {"detail":"Video and audio lists must have the same length"}
[2025-11-11 15:16:31] [ERROR] ❌ Error writing scripts
Traceback (most recent call last):
  File "C:\Vivek_Main\tutter\src\video_pipeline\routes\write_routes.py", line 40, in write_scripts
    video_result = await async_post(video_url, {"path": str(folder),"unique_id":data.unique_id}, timeout=300)
                   ^^^^^^^^^^^^^^^^^^^^^^^^^^^^^^^^^^^^^^^^^^^^^^^^^^^^^^^^^^^^^^^^^^^^^^^^^^^^^^^^^^^^^^^^^^
  File "C:\Vivek_Main\tutter\src\video_pipeline\utils.py", line 15, in async_post
    raise HTTPException(status_code=resp.status_code, detail=resp.text)
fastapi.exceptions.HTTPException: 500: {"detail":"Video and audio lists must have the same length"}
